{"$schema":"https://json-schema.org/draft/2020-12/schema","$id":"https://coh.invalid/contracts/kusto-validator/v1/helper-attestation.schema.json","title":"COH Kusto helper attestation","type":"object","additionalProperties":false,"required":["schema_version","contract_version","attestation_id","observed_at","valid_until","identity","kusto_language_version","dotnet_sdk_version","dotnet_runtime_version","manifest_digest","sbom_digest","provenance_digest","network_denied","credential_classes","reproducible","digest"],"properties":{"schema_version":{"const":"coh.kusto-helper-attestation/v1"},"contract_version":{"const":"1.0.0"},"attestation_id":{"$ref":"#/$defs/uuid"},"observed_at":{"type":"string","format":"date-time"},"valid_until":{"type":"string","format":"date-time"},"identity":{"$ref":"#/$defs/identity"},"kusto_language_version":{"const":"12.4.1"},"dotnet_sdk_version":{"const":"10.0.400"},"dotnet_runtime_version":{"const":"10.0.11"},"manifest_digest":{"$ref":"#/$defs/digest"},"sbom_digest":{"$ref":"#/$defs/digest"},"provenance_digest":{"$ref":"#/$defs/digest"},"network_denied":{"const":true},"credential_classes":{"const":["none"]},"reproducible":{"const":true},"digest":{"$ref":"#/$defs/digest"}},"$defs":{"uuid":{"type":"string","pattern":"^[0-9a-f]{8}-[0-9a-f]{4}-7[0-9a-f]{3}-[89ab][0-9a-f]{3}-[0-9a-f]{12}$"},"digest":{"type":"string","pattern":"^sha256:[0-9a-f]{64}$"},"identity":{"type":"object","additionalProperties":false,"required":["name","version","rid","artifact_digest","package_closure_digest","runtime_digest","registry_digest"],"properties":{"name":{"const":"coh-kusto-validator"},"version":{"const":"kusto-language-12.4.1-coh-1.0.0"},"rid":{"enum":["linux-arm64","linux-x64","osx-arm64"]},"artifact_digest":{"$ref":"#/$defs/digest"},"package_closure_digest":{"$ref":"#/$defs/digest"},"runtime_digest":{"$ref":"#/$defs/digest"},"registry_digest":{"$ref":"#/$defs/digest"}}}}}
