{"schema_version":"coh.kusto-helper-attestation/v1","contract_version":"1.0.0","attestation_id":"018f0000-0000-7000-8000-000000000001","observed_at":"2026-08-28T02:00:00Z","valid_until":"2026-09-27T02:00:00Z","identity":{"name":"coh-kusto-validator","version":"kusto-language-12.4.1-coh-1.0.0","rid":"osx-arm64","artifact_digest":"sha256:aaaaaaaaaaaaaaaaaaaaaaaaaaaaaaaaaaaaaaaaaaaaaaaaaaaaaaaaaaaaaaaa","package_closure_digest":"sha256:bbbbbbbbbbbbbbbbbbbbbbbbbbbbbbbbbbbbbbbbbbbbbbbbbbbbbbbbbbbbbbbb","runtime_digest":"sha256:cccccccccccccccccccccccccccccccccccccccccccccccccccccccccccccccc","registry_digest":"sha256:4b01ac2f77f54138c0a9b5fdab1a5a9195f147804aac44884e03860a83ee6f52"},"kusto_language_version":"12.4.1","dotnet_sdk_version":"10.0.400","dotnet_runtime_version":"10.0.11","manifest_digest":"sha256:dddddddddddddddddddddddddddddddddddddddddddddddddddddddddddddddd","sbom_digest":"sha256:eeeeeeeeeeeeeeeeeeeeeeeeeeeeeeeeeeeeeeeeeeeeeeeeeeeeeeeeeeeeeeee","provenance_digest":"sha256:ffffffffffffffffffffffffffffffffffffffffffffffffffffffffffffffff","network_denied":true,"credential_classes":["none"],"reproducible":true,"digest":"sha256:6850e20ceab077a52ad5f734ab63908583c447305228167d58a068b6689cd7bb"}
